{
  "$schema": "./schemas/rubric.schema.json",
  "version": 2,
  "title": "Premium Web Vertical Slice Quality Rubric",
  "status": "UNPROVEN",
  "scale": {
    "minimum": 0,
    "maximum": 5,
    "anchors": [
      {
        "score": 0,
        "meaning": "Broken, absent, or unusable."
      },
      {
        "score": 1,
        "meaning": "Rough prototype with dominant blockers."
      },
      {
        "score": 2,
        "meaning": "Functional but visibly incomplete or inconsistent."
      },
      {
        "score": 3,
        "meaning": "Solid baseline indie quality with material shortcomings."
      },
      {
        "score": 4,
        "meaning": "Cohesive premium release quality for the intended audience."
      },
      {
        "score": 5,
        "meaning": "Distinctive, highly polished, and class-leading for its scope."
      }
    ]
  },
  "pass_policy": {
    "minimum_weighted_percent": 85,
    "minimum_score_for_any_dimension": 3,
    "minimum_score_for_core_feel": 4,
    "minimum_score_for_world_differentiation": 4,
    "critical_findings_allowed": 0,
    "independent_review_required": false,
    "subjective_dimensions_require_human_evidence": true,
    "missing_score_result": "UNKNOWN"
  },
  "dimensions": [
    {
      "id": "R1",
      "name": "Core control feel and readability",
      "weight": 20,
      "human_evidence_required": true,
      "criteria": [
        "Movement is predictable, responsive, and expressive.",
        "Crown Rush dash, charge, and hazards are clear and readable."
      ],
      "current_score": null,
      "status": "UNKNOWN",
      "evidence_ids": []
    },
    {
      "id": "R2",
      "name": "World and stage differentiation",
      "weight": 20,
      "human_evidence_required": true,
      "criteria": [
        "Goldenwind Forest stages introduce distinct platforming and encounter challenges.",
        "Broken Throne boss fight features telegraphed phase transitions."
      ],
      "current_score": null,
      "status": "UNKNOWN",
      "evidence_ids": []
    },
    {
      "id": "R3",
      "name": "Content value and pacing",
      "weight": 15,
      "human_evidence_required": true,
      "criteria": [
        "Stage progression, secret areas, and boss battle form a coherent 50-70 minute arc."
      ],
      "current_score": null,
      "status": "UNKNOWN",
      "evidence_ids": []
    },
    {
      "id": "R4",
      "name": "Visual, animation, and audio cohesion",
      "weight": 15,
      "human_evidence_required": true,
      "criteria": [
        "Original custom pixel art, UI, effects, and audio tracks form a unified theme."
      ],
      "current_score": null,
      "status": "UNKNOWN",
      "evidence_ids": []
    },
    {
      "id": "R5",
      "name": "Web browser stability and performance",
      "weight": 15,
      "human_evidence_required": false,
      "criteria": [
        "Runs smoothly at 60 FPS in Chrome/Edge without memory leaks or frame drops."
      ],
      "current_score": null,
      "status": "UNKNOWN",
      "evidence_ids": []
    },
    {
      "id": "R6",
      "name": "Accessibility and input coverage",
      "weight": 10,
      "human_evidence_required": true,
      "criteria": [
        "Keyboard and Gamepad controls are rebindable and fully functional."
      ],
      "current_score": null,
      "status": "UNKNOWN",
      "evidence_ids": []
    },
    {
      "id": "R7",
      "name": "Asset license and commercial clearance",
      "weight": 5,
      "human_evidence_required": true,
      "criteria": [
        "All shipped assets have verifiable original or commercial license rights."
      ],
      "current_score": null,
      "status": "UNKNOWN",
      "evidence_ids": []
    }
  ]
}
